{
  "id": "018f3c2a-d001-7000-a1b2-c3d4e5f60001",
  "actor_id": "018f3c2a-6000-7000-a1b2-c3d4e5f60010",
  "actor_role": "subject_teacher",
  "action": "mark.edit",
  "entity_type": "mark",
  "entity_id": "018f3c2a-b001-7000-a1b2-c3d4e5f60001",
  "before": { "score": 14.0, "max_score": 20 },
  "after": { "score": 15.5, "max_score": 20 },
  "device_id": "desktop-teacher-03",
  "occurred_at": "2026-06-16T10:05:00Z",
  "synced_time": null
}
